<!ELEMENT Plantilla (Jugador+)>
<!ELEMENT Jugador (nombre, edad, exEquipo)>

<!ELEMENT nombre (#PCDATA)>
<!ELEMENT edad (#PCDATA)>
<!ELEMENT exEquipo (#PCDATA)>